{
  "schemaVersion": "1.1.0",
  "edition": {
    "id": "curieux-mexique-2026",
    "name": "Curieux Mexique",
    "year": 2026,
    "startsOn": "2026-10-01",
    "endsOn": "2026-11-30",
    "territory": "Cap-Sizun - Pointe du Raz",
    "timezone": "Europe/Paris",
    "contactEmail": "curieuxmexique@lilo.org",
    "tagline": "Programme culturel en Cap-Sizun autour des cultures du Mexique",
    "editorial": {
      "title": "Mot du délégué à la culture",
      "body": [
        "Après la réussite de Curieux Japon à l'automne 2025, l'intercommunalité soutient un nouveau projet collectif ayant comme fil conducteur le dialogue culturel par-delà les frontières.",
        "Associant de nombreux partenaires du territoire, l'événement offre aux habitantes et habitants la possibilité de découvrir la richesse de la civilisation mexicaine à travers la littérature, le chant, la musique, la danse, la photographie, le cinéma, la cuisine, l'artisanat et les arts créatifs.",
        "Le projet vise à créer des passerelles entre les peuples et des interactions sociales et éducatives, grâce aux associations, médiathèques, bibliothèques, écoles, collèges et autres partenaires du Cap-Sizun."
      ],
      "author": "Frédéric Tanter",
      "authorRole": "Vice-président de la Communauté de communes Cap Sizun - Pointe du Raz, délégué à la culture"
    },
    "mediation": [
      "Actions auprès des publics éloignés, notamment en EHPAD, à Kan Ar Mor, dans les écoles et au collège.",
      "Ateliers musicaux à l'école de musique Arviskol autour des rythmes et sonorités mexicains.",
      "Sélections de documents consacrés au Mexique dans les bibliothèques et médiathèques du Cap-Sizun.",
      "Atelier de collectage de sons dans les écoles et le collège, avec échange auprès d'une école du Mexique.",
      "Jeux consacrés au Mexique avec la ludothèque Ti C'hoari en itinérance."
    ],
    "partnerContributorIds": [
      "cap-sizun-pointe-du-raz",
      "le-phare-cite-musicale",
      "pas-de-quartier",
      "departement-finistere",
      "la-obra",
      "info-jeunes-cap-sizun",
      "arviskol",
      "cinema-le-goyen",
      "le-passage",
      "ecoute-on-apprend",
      "les-arts-singuliers",
      "azimuts",
      "la-pointe-emmaus",
      "maison-phare-du-millier",
      "le-pain-dans-le-jardin",
      "la-pluie-dete",
      "le-cedre-bleu",
      "bibliotheque-primelin-organisation",
      "bibliotheque-esquibien-organisation",
      "bibliotheque-plogoff-organisation",
      "bibliotheque-mahalon-organisation",
      "bibliotheque-goulien-organisation",
      "bibliotheque-ti-al-leor-organisation",
      "mediatheque-jeanne-nabert-organisation"
    ]
  },
  "audiences": [
    {
      "id": "all",
      "label": "Tout public",
      "description": "Manifestation ouverte à tous les publics, sous réserve d'une éventuelle indication d'âge."
    },
    {
      "id": "children",
      "label": "Enfants",
      "description": "Manifestation destinée principalement aux enfants."
    },
    {
      "id": "families",
      "label": "Familles",
      "description": "Manifestation adaptée à une participation en famille."
    },
    {
      "id": "teens",
      "label": "Adolescents",
      "description": "Manifestation destinée ou ouverte aux adolescents."
    },
    {
      "id": "adults",
      "label": "Adultes",
      "description": "Manifestation destinée principalement aux adultes."
    }
  ],
  "formats": [
    {
      "id": "inauguration",
      "label": "Inauguration"
    },
    {
      "id": "workshop",
      "label": "Atelier"
    },
    {
      "id": "book-presentation",
      "label": "Présentation de livre"
    },
    {
      "id": "shared-meal",
      "label": "Repas partagé"
    },
    {
      "id": "reading",
      "label": "Lecture"
    },
    {
      "id": "screening",
      "label": "Projection"
    },
    {
      "id": "theatrical-reading",
      "label": "Lecture théâtralisée"
    },
    {
      "id": "language-cafe",
      "label": "Café linguistique"
    },
    {
      "id": "meeting",
      "label": "Rencontre"
    },
    {
      "id": "puppet-show",
      "label": "Spectacle de marionnettes"
    },
    {
      "id": "festival-day",
      "label": "Journée festive"
    },
    {
      "id": "concert",
      "label": "Concert"
    },
    {
      "id": "dance-class",
      "label": "Initiation à la danse"
    },
    {
      "id": "games",
      "label": "Jeux"
    },
    {
      "id": "musical-story",
      "label": "Conte musical"
    },
    {
      "id": "guided-tour",
      "label": "Visite guidée"
    },
    {
      "id": "exhibition",
      "label": "Exposition"
    },
    {
      "id": "jam-session",
      "label": "Session musicale"
    },
    {
      "id": "children-activity",
      "label": "Animation pour enfants"
    }
  ],
  "themes": [
    {
      "id": "visual-arts",
      "label": "Arts visuels"
    },
    {
      "id": "literature",
      "label": "Littérature"
    },
    {
      "id": "languages",
      "label": "Langues"
    },
    {
      "id": "cinema",
      "label": "Cinéma"
    },
    {
      "id": "food",
      "label": "Cuisine"
    },
    {
      "id": "games-theme",
      "label": "Jeux"
    },
    {
      "id": "theatre",
      "label": "Théâtre et conte"
    },
    {
      "id": "music",
      "label": "Musique"
    },
    {
      "id": "dance",
      "label": "Danse"
    },
    {
      "id": "photography",
      "label": "Photographie"
    },
    {
      "id": "heritage",
      "label": "Patrimoine et traditions"
    },
    {
      "id": "society",
      "label": "Société"
    },
    {
      "id": "women",
      "label": "Femmes"
    },
    {
      "id": "indigenous-cultures",
      "label": "Cultures autochtones"
    },
    {
      "id": "sound",
      "label": "Création sonore"
    },
    {
      "id": "migration",
      "label": "Migration"
    }
  ],
  "venues": [
    {
      "id": "maison-site-pointe-du-raz",
      "slug": "maison-site-pointe-du-raz",
      "name": "Maison du Site de la Pointe du Raz",
      "kind": "exhibition-space",
      "address": {
        "street": "La Pointe du Raz",
        "postalCode": "29770",
        "locality": "Plogoff",
        "countryCode": "FR"
      },
      "geo": {
        "latitude": 48.0365126,
        "longitude": -4.7178909
      },
      "website": "https://www.pointeduraz.com/",
      "notes": [
        "Le programme mentionne également la forme courte Maison du Site."
      ],
      "sourceRefs": [
        {
          "source": "brochure",
          "pages": [3, 4, 8, 9, 11, 14, 15]
        },
        {
          "source": "official-web",
          "url": "https://www.pointeduraz.com/sites/files_pointeduraz/files/feuillet_web.pdf"
        }
      ],
      "review": {
        "status": "confirmed",
        "notes": []
      }
    },
    {
      "id": "la-pointe-emmaus-primelin",
      "slug": "la-pointe-emmaus-primelin",
      "name": "La Pointe Emmaüs",
      "kind": "community-space",
      "address": {
        "street": "21 route de la Pointe du Raz",
        "postalCode": "29770",
        "locality": "Primelin",
        "countryCode": "FR"
      },
      "geo": {
        "latitude": 48.0300535,
        "longitude": -4.6164922
      },
      "website": "https://www.cap-sizun.bzh/contacts/la-pointe-emmaus/",
      "notes": [],
      "sourceRefs": [
        {
          "source": "brochure",
          "pages": [5, 14]
        },
        {
          "source": "official-web",
          "url": "https://www.cap-sizun.bzh/contacts/la-pointe-emmaus/"
        }
      ],
      "review": {
        "status": "confirmed",
        "notes": []
      }
    },
    {
      "id": "le-passage-pont-croix",
      "slug": "le-passage-pont-croix",
      "name": "Tiers-lieu Le Passage",
      "kind": "community-space",
      "address": {
        "street": "6 rue des Boucheries",
        "postalCode": null,
        "locality": "Pont-Croix",
        "countryCode": "FR"
      },
      "geo": {
        "latitude": 48.0407541,
        "longitude": -4.4908249
      },
      "website": null,
      "notes": [],
      "sourceRefs": [
        {
          "source": "brochure",
          "pages": [3, 5, 6, 7, 8, 9, 10, 14, 15]
        }
      ],
      "review": {
        "status": "confirmed",
        "notes": []
      }
    },
    {
      "id": "mediatheque-jeanne-nabert",
      "slug": "mediatheque-jeanne-nabert",
      "name": "Médiathèque Jeanne Nabert",
      "kind": "media-library",
      "address": {
        "street": "1 place du 8 Mai 1945",
        "postalCode": null,
        "locality": "Pont-Croix",
        "countryCode": "FR"
      },
      "geo": {
        "latitude": 48.0417513,
        "longitude": -4.4885729
      },
      "website": null,
      "notes": [],
      "sourceRefs": [
        {
          "source": "brochure",
          "pages": [3, 6, 7, 8, 9, 14, 15]
        }
      ],
      "review": {
        "status": "confirmed",
        "notes": []
      }
    },
    {
      "id": "bibliotheque-mahalon",
      "slug": "bibliotheque-mahalon",
      "name": "Bibliothèque de Mahalon",
      "kind": "library",
      "address": {
        "street": "14 Le Bourg",
        "postalCode": null,
        "locality": "Mahalon",
        "countryCode": "FR"
      },
      "geo": null,
      "website": null,
      "notes": [],
      "sourceRefs": [
        {
          "source": "brochure",
          "pages": [3, 5, 6, 14, 15]
        }
      ],
      "review": {
        "status": "confirmed",
        "notes": []
      }
    },
    {
      "id": "bibliotheque-primelin",
      "slug": "bibliotheque-primelin",
      "name": "Bibliothèque de Primelin",
      "kind": "library",
      "address": {
        "street": "Route de l'Océan",
        "postalCode": null,
        "locality": "Primelin",
        "countryCode": "FR"
      },
      "geo": {
        "latitude": 48.0262112,
        "longitude": -4.6113154
      },
      "website": null,
      "notes": [],